<?xml version="1.0" encoding="UTF-8"?>
	<!-- Definition of new Model -->
<model name="strorg:contentmodel" xmlns="http://www.alfresco.org/model/dictionary/1.0"
	xmlns:xsi="http://www.w3.org/2001/XMLSchema-instance"
	xsi:schemaLocation="http://www.alfresco.org/model/dictionary/1.0 modelSchema.xsd">

	<!-- Optional meta-data about the model -->
	<description>SIGLA extension Content Model - Struttura Organizzativa</description>
	<author>Marco Spasiano</author>
	<version>1.3</version>

	<!--
		Imports are required to allow references to definitions in other
		models
	-->
	<imports>
		<!-- Import Alfresco Dictionary Definitions -->
		<import uri="http://www.alfresco.org/model/dictionary/1.0" prefix="d" />
		<!-- Import Alfresco Content Domain Model Definitions -->
		<import uri="http://www.alfresco.org/model/content/1.0" prefix="cm" />
	</imports>

	<!-- Introduction of new namespaces defined by this model -->
	<namespaces>
		<namespace uri="http://www.cnr.it/1.0/" prefix="cnr" />
		<namespace uri="http://www.cnr.it/str/org/1.0/" prefix="strorg" />
		<namespace uri="http://www.cnr.it/str/org/cds/1.0/" prefix="strorgcds" />
		<namespace uri="http://www.cnr.it/str/org/uo/1.0/" prefix="strorguo" />
		<namespace uri="http://www.cnr.it/str/org/cdr/1.0/" prefix="strorgcdr" />
	</namespaces>
	
	<types>
		<type name="cnr:envelopedDocument">
			<title>Documento firmato Digitalmente</title>
			<description>Documento firmato Digitalmente</description>
			<parent>cm:content</parent>
			<associations>
				<association name="cnr:signedDocumentAss">
					<source>
						<mandatory>false</mandatory>
						<many>false</many>
					</source>
					<target>
						<class>cm:content</class>
						<mandatory>true</mandatory>
						<many>false</many>
					</target>
				</association>
			</associations>
		</type>
	</types>		
	<aspects>
		<aspect name="cnr:signedDocument">
			<title>Documento firmato Digitalmente</title>
		</aspect>
		<aspect name="strorg:cds">
			<title>CdS di riferimento</title>
			<properties>
				<property name="strorgcds:codice">
					<title>CdS di riferimento</title>
					<type>d:text</type>
				</property>
				<property name="strorgcds:descrizione">
					<title>Descrizione CdS di riferimento</title>
					<type>d:text</type>
				</property>
			</properties>
		</aspect>
		<aspect name="strorg:uo">
			<title>Uo di riferimento</title>
			<properties>
				<property name="strorguo:codice">
					<title>Uo di riferimento</title>
					<type>d:text</type>
				</property>
				<property name="strorguo:descrizione">
					<title>Descrizione Uo di riferimento</title>
					<type>d:text</type>
				</property>
			</properties>
		</aspect>
		<aspect name="strorg:cdr">
			<title>CdR di riferimento</title>
			<properties>
				<property name="strorgcdr:codice">
					<title>CdR di riferimento</title>
					<type>d:text</type>
				</property>
				<property name="strorgcdr:descrizione">
					<title>Descrizione CdR di riferimento</title>
					<type>d:text</type>
				</property>
			</properties>
		</aspect>

	</aspects>
</model>